{"active_point":{"document_sha256":"1111111111111111111111111111111111111111111111111111111111111111","id":"POINT-AR0062-1","kind":"work-plan","unresolved":false},"event_refs":["EV-AR0062-TUI"],"left_anchor":{"document_sha256":"1111111111111111111111111111111111111111111111111111111111111111","offset":4,"point_id":"POINT-AR0062-1"},"limitations":["ui_behavior_not_proven","user_intent_not_proven","consumer_native_gates_remain_authoritative"],"privacy_projection":{"projection_sha256":"2222222222222222222222222222222222222222222222222222222222222222","public_safe":true,"redacted_fields":["title","prompt","private_path"]},"render":{"accessibility":"keyboard-navigable","active_pane":"left","highlighted_point_id":"POINT-AR0062-1","highlighted_unresolved":false,"layout":"two-pane","left_scroll":4,"narrow_terminal":"degraded","right_scroll":0,"unresolved_point_ids":[]},"schema_version":1,"task":{"id":"AR-0062","revision":1}}
